query,res_queries,answer
美白饮需要服用多久才能见效,美白饮需要服用多久才能见效,我们的皮肤是从内往外生长的过程，口服保养的过程大概可以分为3个阶段：1-2个周期，皮肤通道打开，状态改善；3-4周期，针对皮肤问题，稳定肌肤状态；6个周期之后，多维度的抗衰，巩固前序效果；一般三个周期我们皮肤更新一次，效果会从真皮层到肉眼可见，绝大部分老客户坚持4-6个月之后都能看到肉眼可见的变化。
虾青素每天吃多少粒，什么时候吃,"虾青素每天吃多少粒
虾青素什么时候吃",虾青素每天一粒，随餐或餐后15分钟用温水吞服，一瓶30粒可以吃一个月。一般建议每天吃1粒，35岁以上可每天吃2粒，午餐和晚餐后各1粒。每天12mg已足够吸收，多吃可能导致浪费。
使用产品若干周期或周后的效果如何,"使用产品若干周期后的效果如何
使用产品若干周后的效果如何",使用产品若干周期或周后的效果包括皱纹和法令纹明显改善，皮肤更光滑，肤色提亮，皮肤状态有明显改善。8周真人实测显示皮肤光泽度提升81.19%，角质层含水量提升35.82%，紧致度改善33.74%，皮肤弹性提升14.83%，细纹体积减少20.76%，粗糙度改善22.47%。皮肤状态更加细腻，光泽和纹理有明显改善。坚持使用6个周期后，皱纹和法令纹明显改善，皮肤更加光滑，肤色提亮，整体状态显著提升。
经典款胶原蛋白肽维C饮的饮用方法和时间建议是什么,经典款胶原蛋白肽维C饮的饮用方法和时间建议是什么,经典款胶原蛋白肽维C饮的饮用方法和时间建议如下：建议睡前饮用1支。25岁以上、经期、压力大或熬夜人群建议每天饮用1-2支，白天餐后半小时加睡前1支。25岁以下每天1支。喝酒或服用中药后需间隔两小时再饮用。肾脏代谢异常者不能饮用。高血糖或癌症、肿瘤体质者建议咨询医生。
经期可以喝胶原蛋白肽维C饮吗,经期可以喝胶原蛋白肽维C饮吗,经期可以喝胶原蛋白肽维C饮，不影响。例假期间建议兑温水饮用，避免着凉，尽量不要吃生冷刺激的食物。产品不含激素、类雌激素，是食品级产品，不会影响经期，经期可以放心喝。经期、备孕期、怀孕期、哺乳期均可正常饮用。
一个周期是多久，多个周期对应多少天,"一个周期是多久
多个周期对应多少天",正常是28天，但随着年龄增长会变慢，18岁以后的皮肤新陈代谢周期为实际年龄加上10岁左右
升级款EGCG饮2.0是否含有激素或类雌激素成分，经期能否饮用,"升级款EGCG饮2.0是否含有激素或类雌激素成分
经期能否饮用升级款EGCG饮2.0",升级款EGCG饮2.0不添加任何激素和类雌激素成分，经期可以放心饮用。经第三方检测，146项激素均无检出。
经典肽在经期、备孕期、怀孕期、哺乳期是否可以使用及如何保存,"经典肽在经期是否可以使用
经典肽在备孕期是否可以使用
经典肽在怀孕期是否可以使用
经典肽在哺乳期是否可以使用
经典肽如何保存",经典肽在经期、备孕期、怀孕期、哺乳期均可放心饮用，因为产品不添加任何激素和类雌激素成分。保存方式为常温保存即可。
升级肽应该在睡前还是其他时间饮用,升级肽应该在睡前还是其他时间饮用,升级肽建议在睡前半小时饮用，也可以在饭后或11点多喝，喝了后可以马上睡觉。白天饮用也可以，不影响吸收，但尽量不要空腹喝，建议晚上饮用有助于改善睡眠，且夜间胶原蛋白会自我合成。饮用后可以喝一口水再睡觉，建议在睡前饮用并坚持使用。
美白淡斑精华液孕妇及哺乳期能否使用,美白淡斑精华液孕妇及哺乳期能否使用,孕妇及哺乳期人群需遵医嘱使用。
富铁软糖的适宜食用时间和服用方式是什么,"富铁软糖的适宜食用时间是什么
富铁软糖的服用方式是什么",富铁软糖随时都可以吃，建议随餐或餐后15分钟服用，一般建议在下午或早餐后食用，没有特殊忌口，不限时间，可以一次性吃三颗，没有食用时间或空腹饱腹的禁忌，属于食品级补剂，食用时间很灵活，可以自行安排，没有忌口限制，富铁软糖可以饭后吃。
口服胶原蛋白肽对皮肤有什么效果,口服胶原蛋白肽对皮肤有什么效果,口服胶原蛋白肽对皮肤的效果包括：坚持饮用可使皮肤状态年轻。口服胶原蛋白肽能直达皮肤真皮层，由内到外改善皮肤状态，帮助对抗胶原蛋白和玻尿酸流失，长期使用使皮肤更光滑、细腻，肤色提亮，与同龄人拉开差距。
亢唐是什么产品，其主要成分和作用是什么,"亢唐是什么产品
亢唐的主要成分是什么
亢唐的作用是什么",亢唐是一款多链路抵御AGES损伤皮肤的抗衰老饮品，具有抗糖化和抗氧化作用。其主要成分包括L-阿拉伯糖、白芸豆提取物、鱼腥草、橄榄果和虾青素。L-阿拉伯糖和白芸豆提取物可抑制糖吸收；鱼腥草和橄榄果减少AGEs生成；虾青素具有抗氧化作用，保护皮肤。亢唐通过三段式抗糖功能（拦截糖分分解、破除糖化产物生成、养护细胞）减缓胶原蛋白流失，改善肤色暗沉、发黄、黑色素沉积、斑点、毛孔等问题，防止糖分子与胶原蛋白结合生成AGES，避免皮肤失去弹性，减少胶原蛋白被“烧焦”，从而改善皮肤松弛和皱纹。
富铁软糖的性质、成分、口感及热量情况如何,富铁软糖的性质、成分、口感及热量情况如何,富铁软糖是一种通过补充铁元素来达到补气血作用的功能性软糖，属于保健品而非普通糖果或保养品。其成分为无糖型，使用麦芽糖醇和葡萄糖浆代替传统糖分，且0添加无不良添加。性质上具有清新荔枝香味，无铁腥味，口感QQ弹弹且较好。每颗热量约45.6kcal，相当于一口苹果，适合体重管理期间食用。该产品为赠品，用于补气血。
中奖的益生菌如何领取,中奖的益生菌如何领取,中奖的益生菌领取方式为长按识别图片中的小程序码或点击中奖图片中的二维码进行扫码领取，扫码后需支付0.01元平台费并填写收货地址，提交订单即可完成兑换，赠品将寄送到家。
超级零益生菌怎么服用,超级零益生菌怎么服用,超级零益生菌的服用方法为饭后服用，一天一次，每次一罐，直接嚼着吃即可。可将瓶子从中间掰开倒入口中，或用37度以下温水服用。保质期为18个月，适用于便秘或饮食油腻时使用，有助于肠道健康。
升级肽的口感与老款有何区别，是否有所改善，以及热量情况如何,"升级肽的口感与老款有何区别
升级肽是否有所改善
升级肽的热量情况如何",升级肽的口感与老款不同，老款为百香果味偏酸甜，升级版为枇杷味偏甜，且升级肽因成分含量更足，部分客户反馈口感更佳，比经典肽更好喝没有怪味，口感酸酸甜甜属于大众接受度较高的口味，比较好入口。升级肽每瓶热量约为50卡，无明显负担。若不习惯口感可兑60度以上温水稀释饮用，不影响效果。
胶原蛋白肽饮品如何服用,胶原蛋白肽饮品如何服用,每天建议饮用1-2支，睡前饮用，可直接饮用或兑80-100ml温水（温度不超过60度）25岁及以上、经期、压力大或熬夜人群建议每天饮用1-2支，白天餐后半小时加睡前1支；存在个体差异，25岁以上、熬夜、焦虑时每日可选择2支。
喝胶原蛋白主要是想改善什么皮肤问题,喝胶原蛋白主要是想改善什么皮肤问题,喝胶原蛋白主要是想改善干燥、皱纹、皮肤暗黄、毛孔粗大和皮肤粗糙等问题。
胶原蛋白肽口感太甜是否正常及如何处理,胶原蛋白肽口感太甜是否正常及如何处理,经典肽是百香果味，偏酸甜，产品中添加的是赤藓糖醇作为代糖，几乎无热量，每瓶约50大卡，相当于半个苹果，对体重和血糖没有影响。如果觉得口感太甜，建议用60度以下的温水稀释饮用，这样可以降低甜度且不会影响产品效果。
益生菌的最佳服用时间和方法是什么,"益生菌的最佳服用时间是什么
益生菌的最佳服用方法是什么",益生菌建议在餐后半小时服用，每天饭后半小时用40度以下温水100-150ml冲服1-2袋。腹泻患者不建议使用，服用抗生素期间需间隔2-3小时。
饮用胶原蛋白有何科学依据及改善作用,饮用胶原蛋白有何科学依据及改善作用,饮用胶原蛋白饮品有非常明显的改善作用，建议坚持服用。饮用胶原蛋白能提升皮肤弹性和水润度，减少皱纹和松弛，坚持饮用效果更佳。央广网报道显示，通过调查研究和科学论文验证，饮用该胶原蛋白产品具有明显的改善作用。
经典肽每天建议饮用多少瓶,经典肽每天建议饮用多少瓶,经典肽建议每天饮用2瓶（支），白天餐后半小时一支，晚上睡前一支。25+女性建议每天喝2支，特别是哺乳期等特殊时期，效果更好。每天1~2支就足够了。
胶原蛋白什么时候喝效果最好，睡前或空腹是否更佳,胶原蛋白什么时候喝效果最好，睡前或空腹是否更佳,胶原蛋白建议在睡前喝，效果最佳，可在晚上睡觉前半小时服用，也可在饭后服用。升级肽建议睡前喝，白番茄饮建议早饭后喝，不建议空腹喝。每个人的作息不一样，建议根据自己的饮食习惯来，但一般胶原的合成是在晚上，所以建议睡前半小时喝。一定要坚持喝。
白密码是什么产品及其作用,"白密码是什么产品
白密码的作用是什么",白密码是美白淡斑产品，能提亮肤色，从真皮层到表皮层层淡化黑色素，减少紫外线对皮肤的刺激，帮助美白淡斑、去黄提亮，主打控黑美白淡斑，具有美白功效，且持有美白淡斑特证。白密码属于口服搭配外用的组合，包含美白饮品和美白精华，针对黑色素和斑点问题，早餐后喝一瓶。
升级肽2.0的主要成分、功效、适用人群及相较于1.0版本的改进是什么,"升级肽2.0的主要成分是什么
升级肽2.0的功效是什么
升级肽2.0的适用人群是什么
升级肽2.0相较于1.0版本的改进是什么",升级肽2.0的主要成分包括8000mg胶原蛋白肽、500mg壳寡糖、100mgEGCG、100mg透明质酸钠、100mg弹性蛋白肽，以及添加了CollaShieldPro专利原料和5个女博士独有的核心专利成分【胶原护盾】。其功效为提亮肤色、改善肤色发黄暗沉、帮助缩小毛孔、提升皮肤细腻度和含水量，核心卖点包括补足量、护胶原、蓄水池（含三重玻尿酸）、促吸收（含GABA、锌、烟酰胺和VC）。适用人群为25岁以上，但备孕、怀孕、哺乳期不建议使用。相较于1.0版本，升级肽2.0的胶原蛋白肽含量增加，并含有【胶原护盾】专利成分，可从源头锁住胶原蛋白流失；目前升级肽即2.0版本，无其他区别。
白芸豆压片糖果的作用及服用方法是什么,"白芸豆压片糖果的作用是什么
白芸豆压片糖果的服用方法是什么",白芸豆压片糖果可从食物源头阻碍淀粉和蔗糖的分解吸收。建议在中餐或晚餐餐前服用，用60度以下温水冲服或吞服，一次1袋，可直接嚼着吃或用温水送服。每包含两片，每天一次。
胶原蛋白肽和白密码可以一起或交替饮用吗,"胶原蛋白肽和白密码可以一起饮用吗
胶原蛋白肽和白密码可以交替饮用吗",胶原蛋白肽和白密码可以一起或交替饮用，两者功效不同，白密码主要功效是美白淡斑控黑，胶原蛋白肽主要功效是抗衰补胶原，可以搭配使用且效果不影响。建议搭配一起喝。
您了解过胶原抗老吗,您了解过胶原抗老吗,胶原蛋白锭含有胶原蛋白质、透明质酸钠、维生素C和维生素B类，对皮肤松弛、凹陷和皱纹等问题有改善作用。胶原抗老是通过饮用胶原蛋白饮品实现的，科学研究和论文验证其有明显改善作用，建议坚持饮用。
补充胶原蛋白肽一段时间后感觉不到明显变化是否正常,补充胶原蛋白肽一段时间后感觉不到明显变化是否正常,建议坚持服用并定期拍照对比，每年只喝六个月只能延缓衰老，想要更好效果需持续服用；胶原蛋白流失速度加快后，补充速度要跟上流失速度。
长期饮用胶原蛋白肽的效果及科学依据和副作用,"长期饮用胶原蛋白肽的效果是什么
长期饮用胶原蛋白肽的科学依据是什么
长期饮用胶原蛋白肽的副作用是什么",长期饮用胶原蛋白肽没有副作用，产品为食品级别，不添加激素或类激素成分，符合国家食品安全规定，可放心长期使用。央广网最新报道显示，通过调查研究和科学论文验证，饮用胶原产品具有明显的改善作用，长期坚持可显著减缓衰老。长期饮用可改善皮肤的法令纹、印第安纹、睡眠、眼袋等问题，需坚持6个周期以上效果更明显，其中2-3个月为基础补充期，4-6个月为快速提升期，7-12个月为维稳储能期，1-2年为最佳巩固期。长期饮用可以实现健康的变美效果，无需医美和美妆，素颜出街显得年轻。
多大年龄适合饮用升级肽,多大年龄适合饮用升级肽,适合25岁以上的熟龄肌人群饮用升级肽，每天一支，可在每晚睡前或白天饭后直接饮用或兑60度以下少量温水饮用。禁忌人群包括鱼虾类过敏者、肾功能代谢异常者，备孕、怀孕期、哺乳期不建议饮用，癌症、肿瘤患者建议咨询医生。升级肽能补充胶原蛋白和玻尿酸，38岁胶原流失速率加快时，建议同步调整饮食和睡眠，并使用升级肽进行保养。
盲盒开锁码是多少,盲盒开锁码是多少,盲盒开锁码是616，您按照密码锁方法打开。
哪些人群不能或不建议饮用升级肽,哪些人群不能或不建议饮用升级肽,婴幼儿、孕妇及哺乳期妇女，对鱼、虾、蟹等水产品过敏者不可使用，其余人群均可使用（产品中因为添加了透明质酸，透明质酸因为伦理问题，不能做婴幼儿孕妇及哺乳期临床，在婴幼儿、孕妇和哺乳期妇女人群中的食用安全性资料不足，从风险预防原则考虑，上述人群不宜服用）
白芸豆阿拉伯糖固体饮料的功效、使用方法及注意事项是什么,"白芸豆阿拉伯糖固体饮料的功效是什么
白芸豆阿拉伯糖固体饮料的使用方法是什么
白芸豆阿拉伯糖固体饮料的注意事项是什么",白芸豆阿拉伯糖固体饮料建议中餐或晚餐餐前或随餐服用，每天1条，用40度以下温水60-80毫升冲服。作为三段式抗糖的第一段，餐前吃能有效阻隔人体对蔗糖的吸收，餐前直接泡水喝，可以减少多余糖分的摄入，改善肤色不均匀暗沉发黄、斑斑点点的现象，随餐时用温水吞服一只即可。甲亢患者不建议饮用，低血糖者不建议空腹喝，可随餐服用。吃完大餐之后，可以兑温水喝一条，不用每天吃。
备孕、经期、孕期及哺乳期是否可以饮用经典肽,"备孕是否可以饮用经典肽
经期是否可以饮用经典肽
孕期是否可以饮用经典肽
哺乳期是否可以饮用经典肽",备孕、经期、孕期及哺乳期均可以饮用经典肽。该产品适用于从备孕到哺乳期结束，备孕、孕期、哺乳期人群可以安全饮用经典肽，一天喝两支，白天餐后或晚上睡前饮用。经期、备孕期、怀孕期、哺乳期均可以放心饮用经典肽。
对鱼虾蟹等海鲜过敏者能否饮用胶原蛋白肽维C饮,对鱼虾蟹等海鲜过敏者能否饮用胶原蛋白肽维C饮,对鱼、虾、蟹等水产品过敏者不能饮用胶原蛋白肽维C饮，因为产品含有鱼胶原蛋白肽，可能引发过敏反应。
虾青素的禁用人群及服用方法,"虾青素的禁用人群是什么
虾青素的服用方法是什么",孕期和哺乳期女性不建议服用虾青素。虾青素每天服用1粒，随餐或餐后15分钟用温水吞服。
胶原产品的主要功效和使用效果是什么,胶原产品的主要功效和使用效果是什么,胶原产品的主要功效是抗老，可以改善皮肤法令纹、松弛、凹陷和细纹问题，延缓衰老速度。使用效果方面，此外，饮用胶原产品能明显改善便秘，且有调查研究和科学论文验证效果。当前购买的胶原产品是基础款，而升级肽（粉色8000）是更好版本的胶原，更适合长期保养。
升级肽每瓶添加多少毫克有效成分,升级肽每瓶添加多少毫克有效成分,这款升级肽每瓶添加6000mg，每瓶添加8000mg胶原蛋白肽，每瓶升级肽添加8000mg有效成分，每瓶添加8000mg成分，每瓶添加8000mg，需要每天坚持服用一瓶，才能达到理想效果。
虾青素和富铁软糖的食用方法是什么,虾青素和富铁软糖的食用方法是什么,虾青素每天一粒，随餐或餐后15分钟用温水吞服，建议白天饭后食用，孕期和哺乳期不建议服用。富铁软糖每天3粒，开袋即食，不限时间，适合3岁以上儿童及成人食用，一天不超过三粒，3岁以上儿童及成人、备孕和哺乳期均可食用。胶原蛋白晚上睡前喝一瓶。
亢唐的服用时间、频次及注意事项是什么,"亢唐的服用时间是什么
亢唐的服用频次是什么
亢唐的注意事项是什么","亢唐的服用时间、频次及注意事项如下：一天当中主食吃最多的那一顿餐前喝，如果忘记餐前饮用，餐后喝也可以；主食炒菜吃得最多的一顿餐前或随餐服用，每天1瓶加压片糖果；晚上有聚餐时可在晚餐前喝，餐前忘记餐后也行；建议在午餐前半小时或大餐前服用，但不建议早餐后饮用。备孕、哺乳期不建议饮用；低血糖者不建议空腹喝，可以随餐喝。粉剂可阻挡多余糖分进入体内，每天需服用1瓶加1袋粉剂。
本品如有沉淀或颜色变化为正常现象，请摇匀后饮用。若发现破损，请勿饮用。"
产品效果如何，是否有科学依据,"产品效果如何
产品是否有科学依据",产品效果显著，饮用后可显著改善皮肤状态，有真人检测报告、实验数据报告及央广网报道支持，品牌连续3年全国销量第一，是行业标杆企业。大部分用户在坚持使用4~6个月后反馈光泽度、含水量、弹性提升，细纹和皱纹减少，皮肤状态明显改善。虽然低聚肽直接吸收但补充时也在流失，需长期坚持以堵住流失缺口，长期使用会有改善效果，坚持饮用效果肯定不用担心。
升级款胶原蛋白肽是否含有激素或类雌激素成分,升级款胶原蛋白肽是否含有激素或类雌激素成分,升级款胶原蛋白肽不添加任何激素和类雌激素成分，经期可以放心饮用。
感冒或生病期间能否服用胶原蛋白肽,"感冒期间能否服用胶原蛋白肽
生病期间能否服用胶原蛋白肽",如果没有吃药，可以正常喝；如果喝药了，建议间隔4小时
产品最佳饮用时间是什么时候,产品最佳饮用时间是什么时候,产品最佳饮用时间是每天1支，建议睡前喝，如不吃晚饭可以在白天饭后饮用，白天餐后或晚上睡前饮用最佳。
哪些人群不建议或禁止使用经典肽,"哪些人群不建议使用经典肽
哪些人群禁止使用经典肽",对鱼、虾、蟹等水产品过敏者不能饮用经典肽，肾脏代谢异常（肾功能异常）者不能饮用经典肽，癌症或肿瘤体质者建议咨询医生，糖尿病患者需根据热量遵医嘱饮用经典肽。
富铁软糖小孩可以吃吗,富铁软糖小孩可以吃吗,3岁以上的小孩可以吃富铁软糖，用于补充微量铁元素和气血，但如果孩子气血充足则不建议多吃，避免过度补充。富铁软糖推荐3岁以上儿童、成人、备孕和哺乳期人群都可以放心食用，每天推荐食用3粒，每粒含铁4.6mg，开袋即食，无需特殊时间。
升级肽需要冷藏保存吗,升级肽需要冷藏保存吗,升级肽不需要冷藏保存，常温避光保存即可，不需要强制冷藏或放冰箱。
喝胶原蛋白肽会发胖吗,喝胶原蛋白肽会发胖吗,我们添加的是赤藓糖醇，一种代糖，而且一瓶肽的热量只有50大卡，相当于半个苹果那么多，不会对体重有影响的，长胖主要是总能量的摄入量>总消耗；平时注意合理饮食+适当运动。
升级肽是否含有激素或类雌激素成分，是否安全及热量高低,"升级肽是否含有激素或类雌激素成分
升级肽是否安全
升级肽的热量高低如何",升级肽是食品级饮品，不添加任何激素或类激素成分，也不含类雌激素成分，经期可正常饮用。产品通过第三方安全检测，符合8“0”标准：0激素、0脂肪、0添加防腐剂、0三聚氰胺、0农残、0兽残、0阿斯巴甜、0蔗糖，安全有保障，有无激素检测报告可供参考。一瓶升级肽热量仅相当于半个苹果，不会导致长胖，与食用米饭和鸡蛋一样安全，可长期饮用。
饮用胶原蛋白肽EGCG饮多久能见效或为何感觉无效,"饮用胶原蛋白肽EGCG饮多久能见效
为何感觉饮用胶原蛋白肽EGCG饮无效",饮用胶原蛋白肽EGCG饮大约2个代谢周期后会有比较好的改善，约108天左右，一般三个周期可以看到明显的肉眼变化，35岁的人一个周期为45天，三个周期约为135天。内服效果因人而异，可能体现在睡眠、头发、指甲等方面，面部变化周期更长，建议坚持并拍照对比。口服产品起效需要时间周期，效果可能在真皮层尚未反映到表皮，建议持续使用并拍摄素颜照对比观察。2-3个月为基础补充期，4-6个月为快速提升期，7-12个月为维稳储能期，1-2年为最佳巩固期。
备孕期是否可以饮用升级肽EGCG饮,备孕期是否可以饮用升级肽EGCG饮,备孕期不建议饮用EGCG升级肽，怀孕后应立即停用。玻尿酸在备孕期、怀孕期、哺乳期缺乏足够的食品安全性资料，出于风险预防原则不建议使用。升级肽EGCG饮在备孕、孕期和哺乳期不建议饮用，建议备孕期间改喝经典肽产品。若尚未开始服用叶酸且未正式进入备孕阶段，可以暂时饮用EGCG升级肽。
产品口感太甜怎么办,产品口感太甜怎么办,如果产品口感太甜，可以兑60℃以下的温水饮用，这样口感会变成酸酸甜甜，较易坚持。用温水稀释不会影响产品的效果，且调整口味是为了改善胶原蛋白原有的腥味，帮助坚持饮用。产品中添加的是赤藓糖醇，热量低不会导致发胖，因此用温水稀释是可行的解决方案。
虾青素和胶原蛋白肽可以一起服用吗,虾青素和胶原蛋白肽可以一起服用吗,虾青素在当天热量最高的一餐后15分钟内温水吞服，一天一颗，建议饭后吃；胶原蛋白肽建议睡前喝。虾青素可以和胶原蛋白一起服用，但不建议虾青素和胶原蛋白肽一起服用，因不同产品使用方法不同，效果也会受影响。虾青素是抗氧化的，与胶原蛋白肽饮品协同作用效果更好。
胶原蛋白肽维C饮2.0在经期、备孕、怀孕及哺乳期是否可以饮用,"胶原蛋白肽维C饮2.0在经期是否可以饮用
胶原蛋白肽维C饮2.0在备孕是否可以饮用
胶原蛋白肽维C饮2.0在怀孕是否可以饮用
胶原蛋白肽维C饮2.0在哺乳期是否可以饮用",胶原蛋白肽维C饮2.0不含激素、类雌激素，经期、备孕期、怀孕期、哺乳期可以放心喝。
桑叶白芸豆压片糖果的使用方法和注意事项,"桑叶白芸豆压片糖果的使用方法是什么
桑叶白芸豆压片糖果的注意事项是什么","①取饮品1瓶、压片糖果1袋，饮品与压片糖果一同食用。②饮品直接饮用+压片糖果温水冲服（建议水温不超过60度）
注意事项包括：产品不添加激素和类雌激素成分，经期可放心喝；对鱼虾蟹等水产品过敏者不能喝；癌症肿瘤体质建议咨询医生；糖尿病患者需遵医嘱；备孕期、孕期、哺乳期不建议使用；肾脏代谢异常者不能喝。"
哪些人群不适合饮用EGCG产品,哪些人群不适合饮用EGCG产品,对鱼、虾、蟹等水产品过敏者不能饮用EGCG产品；癌症、肿瘤体质及病史者建议咨询医生；备孕期、孕期、哺乳期不建议使用；肾脏代谢异常者不能饮用；糖尿病患者需根据热量遵医嘱饮用；忌口酒类、浓茶类、药物类、咖啡类，建议间隔4小时以上饮用。
哪些人群不建议饮用美白饮,哪些人群不建议饮用美白饮,鱼类过敏、肾功能代谢异常者不能饮用美白饮，备孕期、怀孕期、哺乳期不建议饮用，癌症、肿瘤患者建议咨询医生。
