query,res_queries,answer
白番茄饮的饮用方式、建议用量及注意事项有哪些,"白番茄饮的饮用方式有哪些
白番茄饮的建议用量有哪些
白番茄饮的注意事项有哪些","白番茄饮的饮用方式为每天1瓶，直接饮用，开启后需及时饮用或于0-6°C冷藏并在24小时内饮用完毕。建议用量为每天饮用一支即可，因人体吸收有阈值，无需过量补充。注意事项包括：鱼类过敏、肾功能代谢异常者不能饮用；备孕期、怀孕期、哺乳期不建议饮用；癌症、肿瘤患者建议咨询医生。白番茄饮每瓶含有8000毫克胶原蛋白肽、100毫克弹性蛋白和100毫克玻尿酸。本品如有沉淀或颜色变化为正常现象，请摇匀后饮用。
若发现破损，请勿饮用。"
经期可以食用虾青素凝胶糖果吗,经期可以食用虾青素凝胶糖果吗,可以服用，经期可以食用虾青素凝胶糖果，不影响使用，产品不含任何激素。
胶原蛋白需要长期坚持补充吗,胶原蛋白需要长期坚持补充吗,胶原蛋白每天都在流失，流失的过程就是衰老的过程，因此需要长期坚持补充，可以长期饮用。当补充量大于流失量时，皮肤状态会越来越好。胶原蛋白肽需要长期饮用，因为胶原蛋白会持续流失，需要长期坚持才能见效。长期补充可以减少胶原蛋白流失，补充玻尿酸，同时胶原蛋白流失需要时间代谢循环才能作用在皮肤表皮层。产品符合8‘0’标准，0激素，安全性高，跟吃米饭鸡蛋一样安全。
多久能看到肉眼可见的明显变化,多久能看到肉眼可见的明显变化,在4-6个代谢周期左右可以看到肉眼可见的变化，大部分老用户反馈在坚持4到6个月后有肉眼可见的变化，三个周期到六个周期可以看到明显的肉眼变化，六个周期共360天，根据大部分35岁客户反馈，6个周期（约240天）可以看到明显变化，根据多数40岁客户反馈，坚持使用4个周期（约200天）可以看到明显改善。
升级款EGCG饮2.0在白天或晚上饮用是否有影响，是否必须晚上喝,升级款EGCG饮2.0在白天或晚上饮用是否有影响，是否必须晚上喝,升级款EGCG饮2.0可以在白天饮用，不影响吸收和效果，可根据个人饮食习惯调整时间。一般建议晚上睡前饮用，因为产品含有GABA成分，有舒缓神经的作用，有助于改善睡眠。胶原蛋白是在休息时大量合成的，保障睡眠时间和质量有助于效果，睡得晚会影响效果。虽然白天喝不影响其他方面，但因含有助眠的GABA成分，建议睡前服用，可根据自身情况调整。
内服保养产品多久见效,内服保养产品多久见效,口服保养分为三个阶段：2-3个月为基础补充期，4-6个月为快速提升期，6个月后效果逐步放大；表皮肌肤状态改善后继续坚持可进入维稳期，1-2年为效果巩固期。4到6个月慢慢可以看到肉眼可见的改变，时间越长效果越明显。内服产品以年为单位见效，需要长期坚持，断断续续喝达不到预期效果。
有客户长期饮用胶原蛋白肽的真实效果案例吗,有客户长期饮用胶原蛋白肽的真实效果案例吗,1985年出生的女性，40多岁，坚持饮用胶原蛋白肽6年，先喝经典肽，后换升级肽已5年，无医美，现在素颜出街，状态年轻，常被误认为20多岁。
产品使用这么久有效果吗,产品使用这么久有效果吗,产品有效果，保养品的效果可从两个维度看：一方面没有变化也是一种效果，即抵抗衰老，避免随年龄增长变得更严重；另一方面皮肤状态变好需要更长时间沉淀。白密码主要针对黑色素，可帮助淡化色斑、改善肤色，8周真人实测数据显示黑色素含量平均下降18.08%，色斑面积减少21.11%，色斑个数减少25.12%，同时皮肤光泽度、含水量、弹性等均有显著提升。美白需要代谢真皮层沉积的黑色素，坚持保养喝到一个月皮肤真皮层开始发生变化，含水量、弹性、光泽度会增加，黑色素、斑点会减少，4到6个月可以看到肉眼可见的改变，时间越久效果越明显。
不同年龄段饮用胶原蛋白肽维C饮的建议用量和时间是什么,"不同年龄段饮用胶原蛋白肽维C饮的建议用量是什么
不同年龄段饮用胶原蛋白肽维C饮的建议时间是什么",25岁以下人群每天饮用1支，25岁以上人群每天饮用2支，建议白天餐后半小时或睡前饮用。经期、熬夜、压力大、睡眠不好、30岁及以上人群建议每天喝2支。
美白淡斑精华液早晚都可以使用吗怎么用,美白淡斑精华液早晚都可以使用吗怎么用,美白淡斑精华液早晚都可以使用，早或晚洁面后取适量均匀涂抹于脸部，轻轻按摩至吸收即可，用在水乳之间。敏感肌初次使用需在耳后做过敏测试，如果发现皮肤不适，请停止使用。孕妇及哺乳期人群遵医嘱使用。建议先建立约4天的耐受期，初期每支可用2-3次，后续可每次使用一支，每天使用一支。
美白饮和胶原蛋白或胶原蛋白肽可以一起服用吗,"美白饮和胶原蛋白可以一起服用吗
美白饮和胶原蛋白肽可以一起服用吗
胶原蛋白和胶原蛋白肽可以一起服用吗",胶原蛋白和胶原蛋白肽可以一起服用吗"
胶原蛋白肽是否有副作用,胶原蛋白肽是否有副作用,胶原蛋白肽作为食品级产品，经过第三方安全检测，符合8“0”标准，包括0激素、热量低，不会导致长胖，安全性高。部分品牌可能添加激素，不适合长期饮用，但五个女博士的产品主要成分为胶原蛋白、弹性蛋白和玻尿酸，经过146项零激素测试，不含激素和类激素成分，本质为小分子蛋白质，已获47国食品安全认证和7大发明专利认证，可长期安全饮用。备孕、孕期、哺乳期均可饮用，与日常食物一样安全，没有副作用。
喝升级肽会发胖吗,喝升级肽会发胖吗,升级肽每一瓶只有50大卡，相当于半个苹果的热量，不含激素，不会导致长胖。升级肽本身热量低，不会导致长胖；体重增加的根本原因是总摄入热量大于总消耗，建议关注饮食、睡眠、运动和代谢情况。
孕妇怀孕期间可以喝升级肽吗,孕妇怀孕期间可以喝升级肽吗,升级肽不建议备孕、孕期、哺乳期饮用，因为添加了透明质酸钠（玻尿酸），作为新食品原料在特殊人群中食用安全性资料不足，法规要求禁止食用。由于无法进行相关人群实验，出于风险预防考虑建议停用。如果不知道怀孕的情况下喝了一个月，停用即可，没有关系。
喝胶原蛋白会发胖吗,喝胶原蛋白会发胖吗,胶原蛋白是安全食品，不会导致体重上升。长胖的本质是总摄入热量大于消耗热量，胶原蛋白本身不会导致长胖，与日常饮食、运动、喝水量、代谢等因素有关。长胖的底层逻辑是摄入量大于消耗量，每多摄入7000大卡能量增加2斤脂肪，需关注整体饮食和代谢情况。胶原蛋白本身不会导致增肥，但体重变化可能与饮食、作息或其他因素有关，建议结合健康饮食和规律作息观察身体反应。
美白淡斑精华液对孕妇和哺乳期人群是否安全或有使用限制,美白淡斑精华液对孕妇和哺乳期人群是否安全或有使用限制,孕妇及哺乳期人群应遵医嘱使用。
胶原蛋白什么时候可以喝,胶原蛋白什么时候可以喝,胶原蛋白肽的话是白天饭后或者晚上睡前喝1瓶都可以，因为我们家的胶原蛋白肽是小分子的低聚肽可以在小肠内主动被吸收，所以任何时间段喝效果都是一样。
喝胶原蛋白肽后失眠或睡眠变差怎么办,"喝胶原蛋白肽后失眠怎么办
喝胶原蛋白肽后睡眠变差怎么办",建议将服用时间调整至白天餐后半小时观察效果，胶原蛋白肽中的GABA正常情况下可促进睡眠，但个体反应可能不同
升级肽和白密码的正确服用方法、用量及注意事项是什么,"升级肽和白密码的正确服用方法是什么
升级肽和白密码的用量是什么
升级肽和白密码的注意事项是什么","升级肽的正确服用方法为每天1支，建议晚上睡前或白天饭后饮用，可直接饮用或兑60度以下温水，均不可空腹饮用；注意事项包括鱼类过敏、肾功能代谢异常者不能饮用，备孕期、怀孕期、哺乳期不建议饮用，癌症、肿瘤患者需咨询医生。白密码的正确服用方法为每天1瓶，早餐后饮用，直接饮用，开启后需冷藏并在24小时内饮用完毕，如有沉淀或颜色变化为正常现象，请摇匀后饮用。
若发现破损，请勿饮用。。"
铁软糖中的铁元素有什么作用，一天吃多少粒,铁软糖中的铁元素有什么作用，一天吃多少粒,铁元素主要是补气血的，一天吃三粒就可以。
超级零益生菌的主要作用是什么,超级零益生菌的主要作用是什么,超级零益生菌的主要作用是调理肠道，适用于体重数字管理期间，非常有效。它适用于想要管理体重、不想挨饿、工作忙饮食不规律导致肠道菌群失衡、口臭胀肚便秘、肠胃动力障碍等亚健康人群，主要作用是调节肠道健康。饭后服用一罐，若饮食油腻或有便秘情况可直接食用。
能否将抗糖产品更换为胶原蛋白或相关组合产品,"能否将抗糖产品更换为胶原蛋白
能否将抗糖产品更换为相关组合产品",可以搭配一起，按1:1比例调换或兑换。客户要求不发抗糖产品时，可全部替换为胶原蛋白和美白饮。根据需求可随时调整发货产品，抗糖产品可换成胶原蛋白肽。
虾青素随餐服用的具体时间和方式是什么,虾青素随餐服用的具体时间和方式是什么,虾青素随餐服用的具体时间和方式是：随餐指吃完药后马上吃饭，或者在吃饭过程中服用；虾青素是脂溶性的，有油脂会更好消化，因此在吃饭的时候吃一粒；虾青素也可以随餐或餐后15分钟服用，温水吞服即可。
能介绍一下抗糖饮吗,"能介绍一下抗糖饮的成分吗
能介绍一下抗糖饮的功效吗
能介绍一下抗糖饮的适用人群吗
能介绍一下抗糖饮的使用方法吗
能介绍一下抗糖饮的注意事项吗",抗糖饮主要对抗糖化反应产生的AGES对皮肤的伤害，防止胶原蛋白流失、皮肤暗沉发黄、松弛和皱纹，有助于延缓衰老，改善肤色。过量的糖与蛋白质结合生成AGES，导致肤色不均、暗黄、长斑、皮肤松弛和皱纹，抗糖可以减少胶原蛋白流失，加速皮肤代谢，改善肤色，延缓衰老。本品如有沉淀或颜色变化为正常现象，请摇匀后饮用。若发现破损，请勿饮用。
经典肽便携装与升级肽在功效、味道及优势上有何区别,"经典肽便携装与升级肽在功效上有何区别
经典肽便携装与升级肽在味道上有何区别
经典肽便携装与升级肽在优势上有何区别",经典肽是经典款胶原蛋白肽，升级肽是升级款，成分更优。便携装和盒装除了味道不同外，其他都一样，便携装适合出差、露营、旅游时更方便携带。本次发放两袋经典肽便携装作为临时使用，后续仍继续服用升级肽。
抗衰老的关键因素有哪些,抗衰老的关键因素有哪些,抗衰老的关键因素包括抗糖化、抗氧化和防晒。抗糖化可以防止胶原蛋白断裂和AGEs生成；抗氧化能够对抗自由基损伤并清除自由基；防晒可以预防光老化和减少紫外线损伤。此外，还需注意少熬夜、运动、保持好心情、防辐射，以及使用抗糖抗氧化的精华和内服产品。
亢糖PRO的服用方法是什么,亢糖PRO的服用方法是什么,饮用方法：①取饮品1瓶、压片糖果1袋，饮品与压片糖果一同食用。②饮品直接饮用+压片糖果温水冲服（建议水温不超过60度）
胶原蛋白肽是否需要冷藏保存,胶原蛋白肽是否需要冷藏保存,胶原蛋白肽不需要冷藏保存，常温避光保存即可。夏天天气热时可以放冰箱冷藏，产品耐高温，常温保存无影响。如果喜欢喝冰的，也可以放冰箱，冷藏后口感更佳。
人体胶原蛋白和玻尿酸随年龄增长的变化规律是什么,"人体胶原蛋白随年龄增长的变化规律是什么
玻尿酸随年龄增长的变化规律是什么",人体从25岁起胶原蛋白开始以1.5%的年流失速率加速流失，到45岁时流失速率约为30%，流失速度显著增加。胶原蛋白和玻尿酸的流失会导致皮肤干燥、皱纹、粗糙暗沉、无弹性、无光泽、保水性下降等问题。
服用胶原蛋白肽是否需要周期性停用，以及停用的时机和特殊情况,"服用胶原蛋白肽是否需要周期性停用
停用胶原蛋白肽的时机是什么
停用胶原蛋白肽的特殊情况是什么",胶原蛋白肽可以一直喝，不需要停一段时间。手术期间需暂停；其他情况如服药、饮酒需间隔两三个小时；经期可正常饮用，无需停用。
饮用胶原蛋白肽是否有科学依据支持其效果,饮用胶原蛋白肽是否有科学依据支持其效果,央广网最新报道显示，通过调查研究和科学论文验证，饮用胶原蛋白肽具有明显改善作用，对皮肤有明显改善作用，饮用该胶原产品具有非常明显的改善作用。
服用复合益生菌固体饮料需要注意什么,服用复合益生菌固体饮料需要注意什么,服用复合益生菌固体饮料需要注意腹泻患者不建议使用，服用抗生素期间需间隔2-3小时。
各年龄段是否都适合饮用胶原蛋白肽维C饮,各年龄段是否都适合饮用胶原蛋白肽维C饮,各年龄段都适合饮用胶原蛋白肽维C饮，建议每天喝2支。30岁及以上人群，如经期、熬夜、压力大、睡眠不好或自身要求较高者，建议每天喝2支。56岁可以服用，建议每天1-2支，周期性观察效果；但对水产品过敏或有肾脏代谢异常者不能饮用，癌症、肿瘤体质者建议咨询医生。
产品是否含有激素或防腐剂,"产品是否含有激素
产品是否含有防腐剂",产品是食品级的保养品，成分安全，通过146项无激素检测，不含任何雌激素成分，同时通过国家级食品标准，确保0激素0类激素。产品不含有任何激素和防腐剂，配料表中不含防腐剂，并提供146项无激素检测报告。产品非常安全，可长期饮用。
升级肽EGCG饮一天喝多少,升级肽EGCG饮一天喝多少,一天喝一支，每天一瓶。
胶原蛋白或胶原蛋白肽产品是否含有激素,"胶原蛋白是否含有激素
胶原蛋白肽产品是否含有激素",胶原蛋白或胶原蛋白肽产品不含任何激素，经过146项无激素检测，实验室检测报告确认不含任何激素成分。
吃中药期间可以喝升级肽吗,吃中药期间可以喝升级肽吗,如果是自己煎煮的中药，需遵医嘱；如果是中成药，需间隔2-4小时。
口服胶原蛋白肽饮品的代谢周期是多久,口服胶原蛋白肽饮品的代谢周期是多久,1-2个代谢周期皮肤通道打开，状态改善；3-4个周期针对皮肤问题，稳定肌肤状态；6个周期后多维度抗衰，巩固效果。
第一次使用产品可以改善哪些皮肤问题,第一次使用产品可以改善哪些皮肤问题,第一次使用产品可以改善的皮肤问题包括暗沉蜡黄、肤色不均、色斑沉积、毛孔粗大、松弛凹陷、痘坑痘印、干纹皱纹。皮肤从内往外生长，口服保养分为三个阶段：2-3个月基础补充期，4-6个月快速提升期，6个月后效果逐步放大，持续坚持可进入维稳期并巩固效果。
抗糖是什么意思,抗糖是什么意思,抗糖是指抵抗体内糖基化终末产物（AGEs）对皮肤的损伤，AGEs是葡萄糖与蛋白质结合产生的物质，日常摄入的米饭、面条、水果、蛋糕等食物中的糖分都可能引发糖化反应。抗糖是抗糖化、抗氧化，减缓胶原蛋白流失，减少糖化反应，阻断黑色素堆积，改善肤色暗沉暗黄，同时也是抗衰、抗老化的。抗糖产品是FIVEDOCTORS内服抗糖营养饮品，分为三个阶段：第1阶段源头阻拦糖化，成分包括专利L-阿拉伯糖、白芸豆提取物和桑叶提取物；第2阶段抗糖buff，成分包括鱼腥草、橄榄果、生姜、余甘子和烟酰胺；第3阶段协同抗氧，成分包括虾青素、黑樱桃和POQ，用于修护糖化损伤，消除自由基。
富铁软糖的服用时间及与其他产品服用的间隔要求是什么,"富铁软糖的服用时间是什么
富铁软糖与其他产品服用的间隔要求是什么",富铁软糖不限时间，像吃零食一样随时吃3粒即可，尽量放在饭后吃，但空腹吃也没有影响，可以根据习惯来，没有饭前饭后限制。销售未明确回答富铁软糖与其他产品应间隔多久服用。
升级肽EGCG饮与经典肽维C饮有何区别和优势,升级肽EGCG饮与经典肽维C饮有何区别和优势,升级肽EGCG饮每瓶含8000mg小分子胶原蛋白肽，比经典维C饮多2000mg胶原蛋白肽，并额外添加500mg壳寡糖、100mgEGCG、100mg透明质酸钠，兼具补水锁水功能，更适合25岁以上抗衰需求人群。
产品效果是否有实测数据支持,产品效果是否有实测数据支持,产品效果有实测数据支持，包括SGS标准8周真人实测数据，显示粗糙度改善+28.85%，紧致度改善+34.73%，细纹体积减少-22.14%，角质层含水量增加+38.86%，光泽度提升+89.90%，皮肤弹性增加23.39%。实验室精密皮肤仪器检测表明，28天后皮肤光泽度、含水量、弹性等指标提升，黑色素沉积和皱纹减少。坚持使用4-6个月可见肉眼改变，时间越久效果越明显。
抗糖饮和肽类产品可以一起饮用吗,抗糖饮和肽类产品可以一起饮用吗,抗糖饮和肽类产品可以一起饮用。抗糖饮和升级肽可以搭配一起喝，效果是1+1大于2；抗糖饮也可以和基础肽一起喝，升级肽补胶原和玻尿酸，抗糖饮对抗糖化反应，一补一堵，效果更好。抗糖饮建议中午饭前半小时喝，升级肽建议晚上睡前半小时喝；抗糖是吃中餐前半个小时喝，一瓶抗糖加一袋压片糖果可以一起服用。
口服升级肽的效果分为几个阶段，每个阶段的具体效果是什么,"口服升级肽的效果分为几个阶段
口服升级肽每个阶段的具体效果是什么",口服升级肽的效果分为三个阶段：1-2个代谢周期皮肤通道打开，状态改善；3-4个周期针对皮肤问题，稳定肌肤状态；6个周期后多维度抗衰，巩固效果。
白密码是否需要与精华配套使用,白密码是否需要与精华配套使用,白密码和美白精华是配套使用的，必须一起用，否则效果没有那么好。1盒升级肽可以1:1兑换1盒美白精华，后续可自由调配。发货时不需要配套，可以自由选择只发白密码饮、只发精华，或两者组合，支持灵活调整。
哺乳期可以喝胶原蛋白肽维C饮吗,哺乳期可以喝胶原蛋白肽维C饮吗,哺乳期可以放心喝胶原蛋白肽维C饮，产品不含激素、类雌激素，经期、备孕期、怀孕期、哺乳期均可放心饮用。哺乳期建议每天2瓶，白天饭后1瓶，晚上睡前1瓶；产品是食品级饮品，可以放心饮用，但海鲜过敏、肾脏代谢异常、癌症、肿瘤体质人群建议咨询医生。
升级肽的最新特点和含量是什么,"升级肽的最新特点是什么
升级肽的含量是什么",升级肽EGCG2.0是升级款胶原蛋白肽，含有玻尿酸成分，兼具补水和补胶原功能，鱼胶原蛋白肽含量为8000毫克，是含量最高的产品，每天晚上睡前喝一瓶即可。
升级肽每天应该服用多少,升级肽每天应该服用多少,升级肽每天应该服用一瓶，建议在每晚睡前或白天饭后饮用，可直接喝或兑60度以下温水饮用。鱼虾类过敏、肾功能代谢异常者不能饮用，备孕期、怀孕期、哺乳期不建议饮用，癌症、肿瘤患者需咨询医生。升级肽只需喝一瓶效果就已足够，喝两瓶效果更好的是经典肽，不是升级肽。
升级款胶原蛋白肽需要冷藏保存吗,升级款胶原蛋白肽需要冷藏保存吗,升级款胶原蛋白肽常温避光保存即可，夏天天气热时也可放入冰箱保存。
虾青素改善哪些皮肤问题,虾青素改善哪些皮肤问题,虾青素改善的皮肤问题包括：抗氧化能力很强，靶向清除自由基，高效吸收紫外线UVA，减少胶原蛋白流失，有助于美白祛黄，改善痘痘、干燥、敏感肌、皱纹、皮肤暗黄或日常保养。
一个周期是多少天,一个周期是多少天,一个周期根据不同信息有不同天数：按照35岁年龄阶段，皮肤代谢周期是45天；皮肤代谢周期为40天，一般40天左右皮肤真皮层开始发生变化；皮肤的一个代谢周期是58天，一般在58天的时候，皮肤的真皮层就发生变化了。
抗糖和胶原蛋白肽是否每天各服用一支,"抗糖是否每天服用一支
胶原蛋白肽是否每天服用一支",抗糖和胶原蛋白肽每天各服用一支，搭配使用效果翻倍。抗糖需在中饭前半小时喝一瓶，胶原蛋白肽则在晚上睡前喝一瓶。抗糖包含一包白芸豆片和一瓶饮品。
有甲状腺结节和甲状腺功能异常且正在服药，可以喝升级肽吗,"有甲状腺结节且在服药可以喝升级肽吗
有甲状腺功能异常且在服药可以喝升级肽吗",身体有特殊情况时不强求购买，建议根据自身情况判断；如有疑虑可提供体检报告由医学顾问评估是否适合饮用。产品为食品级别，不添加任何激素或类激素成分，不影响甲状腺健康。若正在服药，建议与产品间隔2-4小时服用。
白密码饮可以空腹喝吗,白密码饮可以空腹喝吗,不建议空腹喝白密码饮，建议早饭后服用，避免肠胃不适，因为空腹时饮品会被身体当做能量吸收，影响补充到皮肤的效果，应在早餐餐后饮用。
益生菌的作用及服用方法,"益生菌的作用是什么
益生菌的服用方法是什么",益生菌有助于肠胃消化，建议每天饭后半小时用40度以下温水冲服1-2袋。腹泻患者不建议使用，服用抗生素期间需间隔2-3小时。
白芸豆的作用和用途是什么,"白芸豆的作用是什么
白芸豆的用途是什么",白芸豆是抗糖的第一段式，作用于一餐，配合抗糖饮品实现全天抗糖效果。其主要作用是阻断淀粉和蔗糖的吸收，搭配抗糖饮品一起使用时，固液分离使活性更高，效果更好。白芸豆阿拉伯糖固体饮料可抑制淀粉和蔗糖的吸收，建议中餐或晚餐餐前或随餐服用，每天1条，撕开后用40度以下温水60-80毫升冲服。甲亢患者不建议饮用，低血糖者不建议空腹喝，可随餐服用。
抗糖产品有哪些注意事项,抗糖产品有哪些注意事项,备孕、哺乳期不建议饮用，低血糖者不建议空腹喝，可随餐服用。本品如有沉淀或颜色变化为正常现象，请摇匀后饮用。若发现破损，请勿饮用。
白芸豆粉剂的服用时间、方法及用量是什么,"白芸豆粉剂的服用时间是什么
白芸豆粉剂的服用方法是什么
白芸豆粉剂的用量是什么",建议中餐或晚餐餐前或随餐服用，每天1条；撕开后用40度以下温水约60ml冲服；用于预防皮肤糖化。
有子宫肌瘤可以长期喝胶原蛋白肽吗,有子宫肌瘤可以长期喝胶原蛋白肽吗,产品不添加任何雌激素和类雌激素，属于食品级饮品，对子宫肌瘤没有影响，并提供146项无激素检测报告作为证明。产品是0激素，1瓶胶原蛋白肽的热量只有半个苹果。作为食品级别的饮品，如果没有对鱼虾海鲜类过敏，其他情况下都可以正常饮用。
抗糖产品和胶原蛋白肽的推荐服用时间分别是什么，是否可以一起在晚上睡前服用,"抗糖产品的推荐服用时间是什么
胶原蛋白肽的推荐服用时间是什么
抗糖产品和胶原蛋白肽是否可以一起在晚上睡前服用",抗糖产品建议在餐前半小时或随餐服用，不建议睡前服用，具体可中饭前半个小时服用，一天一瓶。胶原蛋白肽建议晚上睡前服用，也可在白天摄入量大的一餐前或饭后半小时服用。抗糖产品可与胶原蛋白肽搭配使用，但服用时间以餐时为宜。
喝酒的人或喝酒后能喝升级款胶原蛋白肽吗,"喝酒的人能喝升级款胶原蛋白肽吗
喝酒后能喝升级款胶原蛋白肽吗",喝酒的人或喝酒后需要与喝酒间隔24小时才能喝升级款胶原蛋白肽。
吃药期间能喝升级款胶原蛋白肽吗,吃药期间能喝升级款胶原蛋白肽吗,西药需间隔2-4小时；中药（自己煎煮）需遵医嘱；中成药需间隔2-4小时。
备孕期可以喝胶原蛋白肽维C饮吗，每天喝几支,备孕期可以喝胶原蛋白肽维C饮吗，每天喝几支,产品不含激素、类雌激素，经期、备孕期、怀孕期、哺乳期可以放心喝，备孕期间每天喝两支。
