query,res_queries,answer
升级肽EGCG饮的成分、功效、作用机制、科学依据及口感如何,"升级肽EGCG饮的成分是什么
升级肽EGCG饮的功效是什么
升级肽EGCG饮的作用机制是什么
升级肽EGCG饮的科学依据是什么
升级肽EGCG饮的口感如何",EGCG升级肽含有8000mg胶原蛋白肽、500mg壳寡糖、100mg EGCG和100mg透明质酸钠，其成分可补充胶原蛋白和玻尿酸，帮助补水锁水，改善皮肤干燥，起到保养和延缓衰老的作用。低聚肽无需分解可直接吸收，但需持续饮用以补充流失。功效方面，SGS实验室检测报告显示坚持使用8周后皮肤弹性、含水量、光泽度提升，细纹减少，多数用户在4~6个月后有肉眼可见变化。作用机制为补充胶原蛋白并帮助皮肤深层补水。口感好喝，若觉得偏甜可兑温水饮用且效果不变。
胶原蛋白肽每瓶的热量是多少，减脂期可以饮用吗,胶原蛋白肽每瓶的热量是多少，减脂期可以饮用吗,每瓶胶原蛋白肽热量不到50大卡，约等于半个苹果，减脂期可以放心饮用。
备孕、孕期、哺乳期及肾脏代谢异常者是否可以饮用升级肽,备孕、孕期、哺乳期及肾脏代谢异常者是否可以饮用升级肽,备孕、孕期、哺乳期及肾脏代谢异常者不建议饮用升级肽，产品注意事项中明确指出这些人群不能喝升级肽。备孕时间较长可以饮用升级肽，但如果随时可能怀孕，建议直接更换为经典肽饮用，备孕要喝经典肽。
皮肤暗沉发黄的原因是什么,皮肤暗沉发黄的原因是什么,皮肤暗沉发黄的原因包括糖化、营养不足和黑色素沉积。糖化是指食物中未被吸收的糖分与蛋白质结合生成糖基化终末产物（AGEs），长期积累会导致皮肤暗沉、发黄、毛孔变大和松弛，碳水化合物摄入也可能引发糖化反应。皮肤暗黄还由于基底层的营养补充不足，导致肌底层细胞新陈代谢速度减慢，黑色素生成速度增加。肤色暗沉的本质是基底层黑色素不断沉积且未能及时代谢出去所致。
孕期和哺乳期可以服用虾青素吗,孕期和哺乳期可以服用虾青素吗,孕期和哺乳期不建议服用虾青素。
胶原蛋白肽的保养周期和效果阶段是怎样的,"胶原蛋白肽的保养周期是怎样的
胶原蛋白肽的效果阶段是怎样的",胶原蛋白肽的保养周期和效果阶段分为：2-3个月为基础补充期，4-6个月为快速提升期，6个月后进入效果放大及维稳期，7-12个月为维稳储能期，1-2年为最佳巩固期。持续使用可巩固效果，与同龄人拉开皮肤状态差距。需长期坚持，想见效快可尽量早睡、做好防晒避免光老化、采用抗糖化饮食减缓胶原流失。
升级肽EGCG饮在什么时间饮用吸收最好,升级肽EGCG饮在什么时间饮用吸收最好,升级肽EGCG饮建议每天一瓶，每晚睡前或白天饭后饮用，其中睡前半小时饮用效果更佳，例如九点到九点半。产品中的GABA成分具有安全助眠作用，且胶原蛋白在晚上合成更利于吸收。虽然早上可以饮用，但建议晚上睡前饮用更好。不要空腹喝，同时备孕、孕期、哺乳期女性不建议饮用，鱼类过敏、肾功能代谢异常者禁用，癌症、肿瘤患者需咨询医生。
虾青素凝胶糖果的功效、适用人群、主要成分及特点是什么,虾青素凝胶糖果的功效、适用人群、主要成分及特点是什么,虾青素凝胶糖果的功效包括改善因熬夜导致的皮肤暗沉和肤色提亮问题，具有抗氧化作用，能减少自由基对皮肤细胞的破坏，防止胶原蛋白流失，改善皮肤弹性，延缓皮肤暗沉、松垮和皱纹，其抗氧化能力是维生素C的6000倍。适用人群为各种肤质，不限人群，但孕妇和哺乳期女性禁用。主要成分为一粒含12mg专利左旋虾青素，采用专研高奢AET系统，包含专利虾青素、专利麦角硫因和进口白番茄。特点包括5倍高纯度、非化工萃取、高活性，采用物理破壁和CO超临界萃取技术保留生物活性，一粒12mg专利左旋虾青素等于其他4mg虾青素的3倍效果。对毛孔问题建议搭配胶原蛋白产品使用。服用方法为每天1粒，随餐或餐后15分钟用温水吞服。
产品需要冷藏保存吗,产品需要冷藏保存吗,产品不需要放冰箱，常温保存即可，可以常温避光保存，避免太阳直射。产品放在阴凉避光处保存即可，不需要放冰箱。夏天天气热的话也可以放冰箱冷藏，若喜欢冰饮可冷藏后饮用，但女性不建议饮用过冰的产品。
美白饮的建议用量、饮用方式及注意事项是什么,"美白饮的建议用量是什么
美白饮的饮用方式是什么
美白饮的注意事项是什么","美白饮的建议用量为每天1瓶，饮用方式为餐后半小时直接饮用，开启后需及时饮用或于0-6°C冷藏并在24小时内饮用完毕，也可将粉末倒入口中送水咽下或加入37°C以下的水或牛奶冲调食用。注意事项包括鱼类过敏、肾功能代谢异常者禁用，备孕期、怀孕期、哺乳期不建议饮用，癌症肿瘤患者需咨询医生。本品如有沉淀或颜色变化为正常现象，请摇匀后饮用。
若发现破损，请勿饮用。"
EGCG的饮用方式和注意事项是什么,EGCG的饮用方式和注意事项是什么,EGCG每天饮用1支，可在每晚睡前或白天饭后饮用，可直接喝或兑60度以下温水。禁忌人群包括鱼类过敏者、肾功能代谢异常者、备孕期、怀孕期、哺乳期女性，癌症或肿瘤患者需咨询医生后使用。
复合益生菌固体饮料的作用是什么,复合益生菌固体饮料的作用是什么,复合益生菌固体饮料的作用包括调节肠道菌落和菌群，缓解便秘，含有膳食纤维有助于维持正常的肠道功能，含有活菌型益生菌和膳食纤维可促进肠道蠕动并维持肠道菌群健康。建议每天早晨空腹用60度以下温水冲服1-2袋，可与胶原蛋白肽搭配使用，但腹泻患者不建议使用，服用抗生素期间需间隔2-3小时。
白密码的使用方法和注意事项是什么,"白密码的使用方法是什么
白密码的注意事项是什么","白密码的使用方法和注意事项如下：每天饮用1瓶，直接饮用，开启后需及时饮用或于0-6°C冷藏并在24小时内饮用完毕；早晚饮用均可，餐后饮用效果最佳。本品含有植物成分，有沉淀属正常现象，摇匀后食用；如遇胀盖、漏液等现象请勿饮用，不适时立即停止服用。鱼类过敏、肾功能代谢异常者不能饮用；备孕期、怀孕期、哺乳期不建议饮用；癌症、肿瘤患者建议咨询医生；婴幼儿、孕妇及哺乳期妇女不宜食用。
本品如有沉淀或颜色变化为正常现象，请摇匀后饮用。
若发现破损，请勿饮用。"
升级肽如何服用,升级肽如何服用,每天一瓶，建议晚上睡前饮用或白天饭后饮用；直接饮用或兑60度以下的温水，如不吃晚饭可在白天饭后饮用；一天一包，与经典肽/胶原蛋白肽不混用，白天餐后6小时内喝，晚上睡前喝。
升级肽和抗糖产品能否搭配使用，效果如何，以及如何与其他保健品如维C、叶酸、B12、螺旋藻等同服,"升级肽和抗糖产品能否搭配使用
升级肽和抗糖产品效果如何
升级肽和抗糖产品如何与维C同服
升级肽和抗糖产品如何与叶酸同服
升级肽和抗糖产品如何与B12同服
升级肽和抗糖产品如何与螺旋藻同服",升级肽和抗糖产品可以搭配使用，1盒升级肽可搭配1盒抗糖产品，实现1+1>2的效果。抗糖产品减少胶原蛋白流失，升级肽补充胶原蛋白，两者搭配是一补一堵，能更快看到皮肤改善，使皮肤更饱满细腻有弹性，同时抗糖产品还能抗糖化、抗氧化，减少糖化反应，阻断黑色素堆积，改善肤色暗沉暗黄，减少细纹皱纹。可以搭配一起喝，抗糖在每天热量最高的一餐前喝，升级肽在每晚睡前半小时喝。产品内含维C和抗氧化成分，可替代部分保健品，建议与其他补充剂如维C、叶酸、B12、螺旋藻等间隔两小时服用，维C可暂停使用。抗糖饮和白芸豆是配套使用，固液分离，活性更高，效果更好。年卡用户可按1:1比例兑换产品。
癌症或肿瘤体质的人能否服用胶原蛋白肽,癌症或肿瘤体质的人能否服用胶原蛋白肽,癌症、肿瘤体质的人建议咨询医生后再决定是否服用胶原蛋白肽，因为产品为食品级，不会对疾病产生影响，但出于慎重考虑仍需咨询医生。
服用胶原蛋白肽饮品多久能看到明显效果,服用胶原蛋白肽饮品多久能看到明显效果,服用五个女博士胶原蛋白肽饮品后，口服代谢周期为46天一个周期，1-2个周期皮肤状态开始改善，3-4个周期稳定肌肤，6个周期后可实现多维度抗衰。一般需要3个代谢周期（约3个月或159天）可以看到明显的肉眼变化，因为皮肤完成一次完整更新需要约28天，超过18岁后代谢周期为年龄+10天。2-3个月为基础补充期，4-6个月为快速提升期，7-12个月为维稳储能期，1-2年为最佳巩固期。喝到一个月皮肤真皮层开始发生变化，4~6个月慢慢看到肉眼可见的改变，时间越长效果越明显。根据大部分用户反馈，坚持饮用5个周期（约245天或300天）后会有肉眼可见的明显变化，70岁可能需要饮用一年以上效果会更明显，产品为食品级，可长期服用。
皮肤代谢周期是多久，需要几个周期才能看到肉眼可见的效果,皮肤代谢周期是多久，需要几个周期才能看到肉眼可见的效果,正常是28天，但随着年龄增长会变慢，18岁以后的皮肤新陈代谢周期为实际年龄加上10岁左右。一个代谢周期后皮肤真皮层的胶原蛋白和弹性蛋白开始发生改变，更加饱满紧致；3到4个周期后肉眼可见变化越来越明显；1~2个周期为皮肤真皮层通道打开阶段；3~4个周期（约4~6个月）开始出现肉眼可见效果；1~2年为巩固维稳阶段，坚持1到2年可以巩固维稳，与同龄人拉开差距。
补充胶原蛋白的作用和必要性是什么,"补充胶原蛋白的作用是什么
补充胶原蛋白的必要性是什么",25岁后胶原蛋白逐渐流失，会导致皮肤松弛、皱纹、干燥、色斑、暗沉、屏障受损，还可能引发骨质疏松、关节疼痛等问题。补充胶原蛋白可提升皮肤弹性与水润度，减少皱纹，改善面部细纹和轮廓，对抗皮肤衰老，有助于骨骼和关节健康。坚持补充胶原蛋白，当补充量大于流失速度时，皮肤状态会逐渐变好，可实现多维度抗衰老。
胶原蛋白肽维C饮的推荐饮用时间和方式是什么,胶原蛋白肽维C饮的推荐饮用时间和方式是什么,胶原蛋白肽维C饮的推荐饮用时间为每天1-2支，睡前饮用最佳，白天可选择餐后半小时饮用1支；25岁以上、经期、压力大、熬夜人群建议每天1-2支，30岁及以上人群建议每天喝2支；饮用方式为直接饮用或兑80-100ml不超过60度的温水，不要空腹超过6小时饮用；对鱼虾蟹等水产品过敏者、肾脏代谢异常者禁用，癌症或肿瘤体质者建议咨询医生。
饮用胶原蛋白肽维C饮多久能看到效果,饮用胶原蛋白肽维C饮多久能看到效果,饮用胶原蛋白肽维C饮后，一个周期（43天）皮肤真皮层的胶原蛋白和弹性蛋白开始改变，更加饱满紧致；一般饮用8周左右，皮肤的含水量、饱满度、弹性、细腻度会有所改善，皮肤光泽度、含水量、弹性等指标开始发生变化。坚持3~4个周期（约4~6个月）开始出现肉眼可见的效果，大部分用户反馈坚持4~6个月后有肉眼可见的改善；3个代谢周期（117天或135天）可观察到皮肤新陈代谢的变化或明显改善，6个代谢周期（234天）或6个周期后改善非常明显。口服周期分为四个阶段：2-3个月为基础补充期，4-6个月为快速提升期，7-12个月为维稳储能期，1-2年为最佳巩固期；坚持3~4个周期（约1~2年）肉眼可见变化越来越明显，1到2年是巩固维稳阶段。胶原蛋白需要一定时间代谢循环才能作用在皮肤表皮层，需要长期坚持喝，见效需要时间。
中奖后如何兑换奖品,中奖后如何兑换奖品,发送订单截图申请兑奖码后，会发送兑奖二维码，扫码填写地址并支付0.01元后提交订单，完成后安排发货；
虾青素凝胶糖果的服用时间是饭前、饭后还是随餐，早晚或中午服用是否有区别,虾青素凝胶糖果的服用时间是饭前、饭后还是随餐，早晚或中午服用是否有区别,虾青素凝胶糖果的服用时间是每天一粒，随餐或餐后15分钟用温水吞服，建议中午或晚上服用，因为虾青素是脂溶性的，跟肉一起吃吸收效果会更好，午餐或晚餐后服用更佳。孕期和哺乳期不建议服用。储存方法为密封、避光、置阴凉干燥处保存。
抗糖产品是什么及其特点和作用,"抗糖产品是什么
抗糖产品有什么特点
抗糖产品有什么作用",抗糖产品是‘每日亢唐’营养素饮品、白芸豆压片糖果+亢唐饮品、FIVEDOCTORS品牌的抗糖化饮品或每日亢唐雨生红球藻虾青素植物饮品，包含一瓶饮品和一袋压片糖果，采用固液分离设计，实现三段式抗糖（源头阻断、降低生成和积累、抑制伤害）。其特点为市面上唯一三段式抗糖饮品，多链路抵御AGES损伤，具有抗糖化、抗氧化功能。作用包括减少胶原蛋白流失，延缓皮肤衰老，抑制糖化反应对皮肤的损伤，阻断黑色素沉积，改善皮肤暗沉发黄、松垮下垂、斑点、毛孔、干纹、细纹、粗糙等问题，提高皮肤代谢能力，主要用于抗衰抗老化，配合胶原蛋白肽使用可改善皮肤糖化导致的暗沉发黄问题，并具有拦截糖分、阻断老化和修复损伤的功能。
白密码和美白精华的使用方法、功效及是否为内服外用组合是什么,"白密码和美白精华的使用方法是什么
白密码和美白精华的功效是什么
白密码和美白精华是否为内服外用组合",白密码为内服产品，建议每天早餐后喝1瓶，直接饮用或于0-6°C冷藏并于24小时内饮用完毕，鱼类过敏、肾功能代谢异常者不能饮用，备孕期、怀孕期、哺乳期不建议饮用，癌症肿瘤患者建议咨询医生。美白精华为外用产品，早晚洁面后取适量涂抹脸部，轻轻按摩至吸收，应在晚上洁面后、爽肤水和乳液之间使用，初次使用需建立耐受，避开眼周，敏感肌需在耳后做过敏测试，如皮肤不适请停止使用，孕妇及哺乳期人群遵医嘱使用。白密码和美白精华适用于肤色不均、斑点、皮肤暗沉、色素沉着、紫外线晒红晒伤修复和美白需求的人群。
胶原蛋白肽饮品的饮用方法、建议用量及口感调整方式是什么,"胶原蛋白肽饮品的饮用方法是什么
胶原蛋白肽饮品的建议用量是什么
胶原蛋白肽饮品的口感调整方式是什么",五个女博士胶原蛋白肽饮品的饮用方法为每天1-2支，睡前饮用，可以直接饮用或兑80-100ml温水（建议不超过60度），若觉得甜可用温水兑饮，喝完后也可喝点温水缓解甜味。建议用量为每天1瓶，25岁以上、熬夜或焦虑时可选择每日2支，开启后请及时饮用或于0-6°C冷藏，并在24小时内饮用完毕。口感调整方式为若觉得甜可用温水兑饮，喝完后也可喝点温水缓解甜味。
白芸豆阿拉伯糖固体饮料是什么及其功效和作用,"白芸豆阿拉伯糖固体饮料是什么
白芸豆阿拉伯糖固体饮料的功效是什么
白芸豆阿拉伯糖固体饮料的作用是什么",白芸豆阿拉伯糖固体饮料是一种帮助减少淀粉和蔗糖吸收的产品，含有白芸豆提取物，主要功效是可以减少多余淀粉以及蔗糖的分解和吸收，建议饭后半小时兑温水喝一包。
胶原蛋白肽维C饮适合哪些人群饮用,胶原蛋白肽维C饮适合哪些人群饮用,胶原蛋白肽维C饮适合20岁以上初步出现胶原流失的轻熟肌人群，尤其推荐25岁左右以及孕期、备孕、哺乳期阶段人群饮用，产品不含激素和类雌激素，经期、备孕期、怀孕期、哺乳期可以放心饮用，建议每天喝两瓶。
使用美白精华液的注意事项和使用方法是什么,"使用美白精华液的注意事项是什么
使用美白精华液的使用方法是什么",使用美白精华液的注意事项和使用方法包括：孕妇及哺乳期人群应遵医嘱使用；每天使用一次；前3-5天取1-2滴涂抹脸颊边缘建立耐受，适应后可全脸使用；敏感肌需先在耳后做过敏测试，如有不适需停止使用；洁面后取适量涂抹脸部并按摩至吸收；初次使用需建立耐受。
维C饮的服用建议和剂量是什么,维C饮的服用建议和剂量是什么,25岁以下每天一支，25岁以上每天两支。
衰老的三大杀手是什么及如何防御,"衰老的三大杀手是什么
如何防御衰老的三大杀手",衰老的三大杀手是紫外线、氧化和糖化。防御方法包括：针对紫外线使用防晒和美白产品（口服或外用）；针对氧化补充胶原蛋白和抗糖化；针对糖化进行抗糖化。紫外线会诱发蛋白和糖的反应（AGEs），氧化会加快自由基和蛋白的产生，糖化反应会导致AGEs的堆积并加剧氧化反应。三者相互影响，紫外线诱发蛋白糖化，氧化加快自由基生成，糖化与氧化反应加剧形成恶性循环加速衰老。
胶原蛋白肽饮品的饮用方法、注意事项及忌口有哪些,"胶原蛋白肽饮品的饮用方法有哪些
胶原蛋白肽饮品的注意事项有哪些
胶原蛋白肽饮品的忌口有哪些",五个女博士胶原蛋白肽饮品的饮用方法为每天1-2支，睡前饮用，可直接饮用或兑80-100ml温水（不超过60度）。注意事项包括对鱼、虾、蟹等水产品过敏者及肾脏代谢异常者禁用；癌症、肿瘤体质建议咨询医生；备孕、孕期、哺乳期不建议饮用；高血糖、癌症、肿瘤患者饮用前需咨询医生。忌口方面，饮用期间应避免酒类、浓茶、药物、咖啡类，建议与这些物质间隔2-4小时以上；喝酒或吃中药后需间隔两小时再饮用；鱼类海鲜过敏者、肾功能代谢异常者禁用。开启后需冷藏(0-6℃)并在24小时内饮用完毕。
饮用升级款胶原蛋白肽有哪些注意事项,饮用升级款胶原蛋白肽有哪些注意事项,饮用升级款胶原蛋白肽的注意事项包括：鱼类、海鲜、蛋白质过敏人群不建议使用；肾功能或肾脏代谢异常者不能饮用；备孕期、怀孕期、哺乳期不建议饮用；癌症、肿瘤患者或有相关病史者建议咨询医生后再决定是否使用；忌口酒类、浓茶类、药物类、咖啡类，建议间隔2小时以上饮用；产品不添加任何激素和类雌激素成分，经期可以放心喝。
口服虾青素多久能看到效果,口服虾青素多久能看到效果,一般4-6个周期就可以看到肉眼可见的效果，一个周期通常是年龄+10天
胶原蛋白肽的效果如何,胶原蛋白肽的效果如何,胶原蛋白肽的效果表现为坚持使用4-6个月后可看到肉眼可见的皮肤改善，包括皮肤光泽度、含水量、弹性提升，黑色素和皱纹减少。内服保养是循序渐进的过程，长期坚持效果更好，大部分客户在坚持使用3到6个月后有比较好的效果。皮肤新陈代谢周期一般为28天，超过18岁后为年龄+10天，一个周期后皮肤光泽度提升、黑色素和斑点减少等数据已有改善。SGS8周真人实测数据显示粗糙度改善+28.85%，紧致度改善+34.73%，细纹体积减少-22.14%，角质层含水量提升+38.86%，光泽度提升+89.90%，同时起皱减少28%，斑点减少35%，松弛减少33%，粗糙减少16%，皮肤光泽度提升20%，水分含量提升22%。一般在60天左右皮肤真皮层发生变化，4~6个周期后皮肤含水量、饱满度、弹性、细腻度会有改善。实际使用案例显示肤色更白净细腻，眼袋黑眼圈改善，法令纹淡化，皮肤更紧致饱满。
胶原蛋白肽升级款与经典款有何区别,胶原蛋白肽升级款与经典款有何区别,升级肽egcg饮是8000mg的胶原蛋白肽，基础款经典肽是6000mg，可以明显看到升级肽，成份含量都增加了，最重要的是新增成份主要是玻尿酸原料，所以补水锁水效果更好，改善皮肤问题，第一步就是需要先补水锁水嘛，因为无论是胶原蛋白还是弹力蛋白都是需要在水环境中生存哒~25岁之后的姐妹如果喝经典肽更多需要一日两瓶，保养成本更高一些，升级肽每日一瓶就可以，同时也省了补水的成本，长期日常保养更省钱哦~
哪些人群不能饮用白密码,哪些人群不能饮用白密码,鱼类过敏者、肾功能代谢异常者不能饮用白密码；备孕期、怀孕期、哺乳期不建议饮用；癌症、肿瘤患者建议咨询医生；婴幼儿不宜饮用。
饮用升级肽期间需要忌口什么,饮用升级肽期间需要忌口什么,饮用升级肽期间需要忌口酒类、浓茶类、药物类、咖啡类，建议与产品间隔2小时以上。
胶原蛋白肽维C饮2.0的适用人群、忌口、服用方法及作用是什么,"胶原蛋白肽维C饮2.0的适用人群是什么
胶原蛋白肽维C饮2.0的忌口是什么
胶原蛋白肽维C饮2.0的服用方法是什么
胶原蛋白肽维C饮2.0的作用是什么",胶原蛋白肽维C饮2.0的适用人群包括经期、备孕、怀孕、哺乳期人群，但对鱼、虾、蟹等水产品过敏者、肾脏代谢异常者不能饮用，癌症、肿瘤体质者建议咨询医生，糖尿病患者需根据热量遵医嘱饮用。忌口包括酒类、浓茶类、药物类、咖啡类，建议与这些物品间隔4小时以上服用。服用方法为每天1-2支，每晚睡前或白天饭后饮用，可直接喝或兑60度以下温水，整体口感偏酸甜用于压制胶原蛋白肽的腥味，若觉得过甜或过酸可兑60度以下温水稀释。作用是补充流失的胶原蛋白及弹性蛋白，维持肌肤柔软性和弹性，促进肌肤健康。
多久能看到效果,多久能看到效果,口服代谢周期为60天左右，皮肤口服保养分为三个阶段：1-2个周期皮肤通道打开，状态改善；3-4个周期稳定肌肤状态；6个周期后多维度抗衰，巩固效果。6个周期约360天，一年左右可见明显改善。坚持6个月后效果逐步放大，表皮肌肤状态得到改善，继续坚持能达到维稳期，1-2年是效果巩固期。皮肤新陈代谢一个周期大概是50-60天，口服胶原蛋白保养需要一定周期，绝大部分老用户表示使用4-6个月能看出明显效果，本身保养较好的用户可能需要更长时间。权威仪器检测28天后真皮层开始变化，肉眼可见效果一般在半年左右，6个月左右会有明显变化。1-2个周期皮肤真皮层通道打开，3-4个周期即4-6个月开始出现肉眼可见的效果。
对鱼虾海鲜或蛋白质过敏的人能否服用胶原蛋白肽,对鱼虾海鲜或蛋白质过敏的人能否服用胶原蛋白肽,对鱼虾海鲜或蛋白质过敏的人不能服用胶原蛋白肽，因为胶原蛋白肽是从鱼中提取的，含有鱼成分，可能引发过敏反应，存在过敏风险，因此不建议使用。
升级胶原蛋白肽的效果是否有实测或科学依据,"升级胶原蛋白肽的效果是否有实测依据
升级胶原蛋白肽的效果是否有科学依据",升级胶原蛋白肽的效果有实测和科学依据。SGS8周真人实测显示，55名31-50岁中国女性每天饮用一支持续8周后，皮肤粗糙度改善28.85%，紧致度改善34.73%，细纹体积减少22.14%，角质层含水量增加38.86%，光泽度提升89.90%。实验室检测中，皮肤弹性提升23.39%以上，粗糙度改善28.85%以上。坚持饮用一个月后，皮肤真皮层开始发生变化，皮肤含水量、弹性、光泽度增加，细纹、粗糙度、斑点、黑色素减少。持续使用4~6个月可见肉眼改变，时间越久效果越明显。
胶原蛋白肽对皮肤及其他身体方面有哪些功效,胶原蛋白肽对皮肤及其他身体方面有哪些功效,"补：鱼胶原蛋白肽6000mg+鱼弹性蛋白肽100mg，双重促进，锁紧胶原弹力网，在配料表中排名第一护：添加专利原料CollaShieldPro胶原护盾（多通路降低AGEs对胶原蛋白及弹性蛋白的损伤，源头减少胶原蛋白流失）
促：复配成分：GABA（γ-氨基丁酸）、维C、锌和烟酰胺，好环境+好营养，高效促进胶原合成
GABA（γ-氨基丁酸）：GABA帮助平静、改善睡眠，改善皮肤弹性弹性蛋白合成和弹性蛋白纤维形成。
维C：维生素Ｃ具有增加皮肤I型胶原蛋白合成锌：锌有助于皮肤健康。烟酰胺：有助于维持皮肤和黏膜健康。"
吃药期间可以喝胶原蛋白肽吗,吃药期间可以喝胶原蛋白肽吗,对于吃药的用户，西药：间隔2-4小时；中药（自己煎煮）：遵医嘱；中成药：间隔2-4小时
